{
  "set_id": "SET-007",
  "name": "SET-007 (Book 7) â€” ORIGIN FRAME (Aetherion)",
  "anchor_book": "",
  "reveal_level": "S3",
  "mechanic_budget": {
    "new_keywords_max": 4,
    "new_subsystems": [
      "chronicle_layer"
    ]
  },
  "app_requirements": {
    "requires_smart_mat": true,
    "requires_hidden_intent": false,
    "requires_time_windows": true,
    "requires_chronicle_layer": true
  },
  "notes": "Generated from scaffolds on 2025-12-30.",
  "keyword_pool_path": "../../AUTHORING/KEYWORD_POOLS/SET-007.keyword_pool.json"
}