{
  "set_id": "SET-001",
  "name": "SET-001 â€” Overview",
  "anchor_book": "book_01",
  "reveal_level": "S0",
  "mechanic_budget": {
    "new_keywords_max": 0,
    "new_subsystems": []
  },
  "app_requirements": {
    "requires_smart_mat": true,
    "requires_hidden_intent": false,
    "requires_time_windows": true,
    "requires_chronicle_layer": false
  },
  "notes": "Generated from scaffolds on 2025-12-30.",
  "keyword_pool_path": "../../AUTHORING/KEYWORD_POOLS/SET-001.keyword_pool.json"
}